{
  "$schema": "https://json-schema.org/draft/2020-12/schema",
  "version": "1.0.0",
  "agent": "ALVIS",
  "capabilities": {
    "search": ["search_*", "fetch_*"],
    "plan": ["plan_*"],
    "request": ["request_*"]
  },
  "directExecutorToolsDenied": true,
  "approvalModel": "request_* remains pending until explicit approval evidence is attached"
}
